{
  "schema_version": 1,
  "contract": "coordinator-state-v1",
  "project_id": "kis-mcp",
  "change_id": "historical-disjoint-liveness",
  "state": "degraded",
  "authority_revision": 2,
  "active_reservation_ids": [
    "140-registered-external-acquisition",
    "145-skill-usage-telemetry",
    "148-project-created-field-read"
  ],
  "integration_owner": null,
  "degraded_components": {
    "exclusive-claim-overlap-140-145": {
      "affected_paths": ["src/kis_mcp/capabilities/surface.py"],
      "reason": "the conflicting component is isolated from disjoint adapter work",
      "disjoint_admission": "allowed",
      "reservation_checks": [
        {
          "reservation_id": "140-registered-external-acquisition",
          "intersects_degraded_component": true,
          "component_result": "blocked_by_component"
        },
        {
          "reservation_id": "145-skill-usage-telemetry",
          "intersects_degraded_component": true,
          "component_result": "blocked_by_component"
        },
        {
          "reservation_id": "148-project-created-field-read",
          "intersects_degraded_component": false,
          "component_result": "clear_of_component"
        }
      ]
    }
  }
}
